{
  "consistency": {"artifact_leaks": 0, "external_service_invocations": 0, "rollback_hash_matches_export": true, "state_write_authority": false},
  "generated_at": "2026-08-18T11:04:46.353740+00:00",
  "package": {"artifact_sha256": "fcc5653649704891350f9de732fcb10a33dd2fc372a2e01801fac6b0179f03df", "name": "continuity-plane", "version": "0.1.0a1"},
  "platform": {"machine": "AMD64", "python": "3.12.10", "release": "11", "system": "Windows"},
  "profile": {"admin_required": false, "container_required": false, "external_services_required": 0, "requested_profile": "local-embedded", "state_adapter": "sqlite"},
  "project_id": "native-windows",
  "receipt_sha256": "3be2c22f55e551f8362e58d4e71033efeff899a7d37dc15c78578c02e8d0b5a6",
  "schema_version": "context.native-install-matrix/v1alpha1",
  "steps": {
    "export": {"duration_ms": 0, "output_sha256": "cccca5cad875e1776fa9b4d3596064ad427fa27619470b874259aedadcffe0de", "status": "blocked"},
    "import": {"duration_ms": 0, "output_sha256": "cccca5cad875e1776fa9b4d3596064ad427fa27619470b874259aedadcffe0de", "status": "blocked"},
    "install": {"duration_ms": 10078.0, "output_sha256": "795c7981972cd0a1a0f2d0041944b3af13d1227674bf4f4aab89fb86d3e94f47", "status": "passed"},
    "rollback": {"duration_ms": 0, "output_sha256": "cccca5cad875e1776fa9b4d3596064ad427fa27619470b874259aedadcffe0de", "status": "blocked"},
    "uninstall": {"duration_ms": 47.0, "output_sha256": "dac59dd2af2ad14f9cb5ad77ef4561b2fc96a78573df3b4d1620871019a7d3ef", "status": "passed"},
    "verify": {"duration_ms": 156.0, "output_sha256": "8f5292bd5fc4c604b723f13a0ff8095afab68c4b98428b47283fd107a55173df", "status": "passed"}
  },
  "verdict": "blocked"
}
